{
  "$schema": "./registry.schema.json",
  "version": 1,
  "generated_at": "2026-05-02T06:05:36.573Z",
  "source": {
    "repo": "utensils/claudette-community",
    "ref": "main",
    "sha": "382298b4206010cea7865ae811c39e2a90d5c7fa"
  },
  "themes": [],
  "plugins": {
    "scm": [],
    "env-provider": [],
    "language-grammar": [
      {
        "name": "lang-nix",
        "display_name": "Nix",
        "version": "1.0.0",
        "description": "Nix language syntax highlighting (TextMate grammar from nix-community/vscode-nix-ide)",
        "kind": "language-grammar",
        "operations": [],
        "author": "utensils",
        "license": "MIT",
        "submitted_at": "2026-05-01",
        "source": {
          "type": "in-tree",
          "path": "plugins/language-grammars/lang-nix",
          "sha": "382298b4206010cea7865ae811c39e2a90d5c7fa",
          "sha256": "4a6220497e5787231efc74bfff0d1c449767fd205ce3ef0132e89e23aece4978"
        },
        "languages": [
          {
            "id": "nix",
            "extensions": [
              ".nix"
            ],
            "aliases": [
              "Nix"
            ]
          }
        ],
        "grammars": [
          {
            "language": "nix",
            "scope_name": "source.nix",
            "path": "grammars/nix.tmLanguage.json"
          }
        ]
      }
    ]
  },
  "slash_commands": [],
  "mcp_recipes": []
}
